{
  "schema_version": "1.0.0",
  "certificate_id": "cert_squid_pos3",
  "created_at": "2026-09-05T10:00:00Z",
  "source_id": "squid-proxy-01",
  "pack_id": "squid-native",
  "family_id": "positional-10",
  "context": { "l1_envelope": "raw", "l2_structure": "positional", "l3_anchors": [], "slot_index": 2, "token_class": "ipv4" },
  "field": { "path": "pos_3", "sample_values": ["10.20.14.62", "10.20.9.140", "10.20.31.7"] },
  "event_class": { "uid": 4002, "name": "http_activity", "ocsf_version": "1.3.0" },
  "enumeration": {
    "method": "validator-enumeration",
    "table_hash": "sha256:c464271e165faa8af6064254a3be8a3b7f4d2acb5a9f32ee5a71b2d0623e7cba",
    "candidates": [
      { "attribute": "device.ip", "type": "ip_t", "basis": "ip_t accepts an IPv4 value" },
      { "attribute": "dst_endpoint.intermediate_ips", "type": "ip_t", "basis": "ip_t array; excluded from survivors: slot holds a scalar" },
      { "attribute": "dst_endpoint.ip", "type": "ip_t", "basis": "ip_t accepts an IPv4 value" },
      { "attribute": "http_request.x_forwarded_for", "type": "ip_t", "basis": "ip_t array; excluded from survivors: slot holds a scalar" },
      { "attribute": "load_balancer.ip", "type": "ip_t", "basis": "ip_t accepts an IPv4 value" },
      { "attribute": "proxy.intermediate_ips", "type": "ip_t", "basis": "ip_t array; excluded from survivors: slot holds a scalar" },
      { "attribute": "proxy.ip", "type": "ip_t", "basis": "ip_t accepts an IPv4 value" },
      { "attribute": "proxy_endpoint.intermediate_ips", "type": "ip_t", "basis": "ip_t array; excluded from survivors: slot holds a scalar" },
      { "attribute": "proxy_endpoint.ip", "type": "ip_t", "basis": "ip_t accepts an IPv4 value" },
      { "attribute": "proxy_http_request.x_forwarded_for", "type": "ip_t", "basis": "ip_t array; excluded from survivors: slot holds a scalar" },
      { "attribute": "src_endpoint.intermediate_ips", "type": "ip_t", "basis": "ip_t array; excluded from survivors: slot holds a scalar" },
      { "attribute": "src_endpoint.ip", "type": "ip_t", "basis": "ip_t accepts an IPv4 value" }
    ],
    "survivors": ["device.ip", "dst_endpoint.ip", "load_balancer.ip", "proxy.ip", "proxy_endpoint.ip", "src_endpoint.ip"]
  },
  "ranked_candidates": [
    { "rank": 1, "attribute": "src_endpoint.ip", "proposed_by": "model" },
    { "rank": 2, "attribute": "dst_endpoint.ip", "proposed_by": "model" }
  ],
  "evidence": {
    "vendor_metadata": "absent",
    "structural": { "status": "weak", "note": "positions 3 and 9 (after '/') are symmetric IPv4 slots; RFC1918-vs-public is not used — both endpoints can legitimately be private and line 3 shows a private value at position 9" },
    "held_out_consistency": "tied",
    "type_validity": "tied",
    "discriminator": { "status": "available", "ambiguity_class": "endpoint_orientation", "library_version": "1.0.0" }
  },
  "status": "ambiguous",
  "request": {
    "ambiguity_class": "endpoint_orientation",
    "sufficiency_group": "sg_squid_logformat",
    "selected": { "discriminator_id": "device_logformat_configuration", "cost_tier": "free_if_available", "rank": 1, "resolves": ["pos_3", "pos_5", "pos_2", "pos_4", "pos_9"] },
    "alternatives": [
      { "discriminator_id": "vendor_schema_field_order", "cost_tier": "free_if_available", "rank": 2, "resolves": ["pos_3", "pos_5"] },
      { "discriminator_id": "operator_labelled_session", "cost_tier": "one_labelled_sample", "rank": 3, "resolves": ["pos_3"] },
      { "discriminator_id": "paired_flow_telemetry", "cost_tier": "correlated_source", "rank": 4, "resolves": ["pos_3"] }
    ],
    "text": "Two fields cannot be resolved from the samples alone. Provide the logformat directive from this device's configuration, or confirm the format name if it is a built-in. This resolves both, and four other fields at the same time."
  }
}
